{
  "contract_status": "foundation-design-contract-not-deployed",
  "effective_at": "2038-01-19T03:16:07.000Z",
  "organizations": [{"id":"org_demo_alpha","display_label":"Synthetic Organization Alpha (non-customer)","state":"active","policy_version":1,"contract_version":"organizations/v1","project_ids":["project_demo_alpha"],"role_assignment_ids":["assignment_demo_owner"],"created_at":"2038-01-19T03:14:07.000Z","updated_at":"2038-01-19T03:14:07.000Z"}],
  "projects": [{"id":"project_demo_alpha","organization_id":"org_demo_alpha","display_label":"Synthetic Project Alpha (non-customer)","state":"active","allowed_origins":["https://widget-alpha.example.invalid"],"api_major_allowlist":[1],"key_reference_ids":["keyref_demo_current","keyref_demo_previous"],"hosted_config_version_ids":["config_demo_rev1","config_demo_rev2"],"active_hosted_config_version_id":"config_demo_rev2","created_at":"2038-01-19T03:14:07.000Z","updated_at":"2038-01-19T03:15:07.000Z"}],
  "role_assignments": [{"id":"assignment_demo_owner","principal_id":"principal_demo_owner","organization_id":"org_demo_alpha","project_id":null,"role":"owner","permissions":["audit.read","configs.manage","configs.read","keys.manage","keys.read","organization.read","project.configure","project.read","roles.manage","roles.read"],"state":"active","effective_at":"2038-01-19T03:14:07.000Z","revoked_at":null,"created_at":"2038-01-19T03:14:07.000Z","updated_at":"2038-01-19T03:14:07.000Z"}],
  "key_references": [
    {"id":"keyref_demo_previous","organization_id":"org_demo_alpha","project_id":"project_demo_alpha","api_major":1,"permissions":["api.read"],"quota_summary":{"window":"hour","request_limit":1000},"state":"revoked","not_before":"2038-01-19T03:14:07.000Z","expires_at":"2038-01-20T03:14:07.000Z","rotation_predecessor_id":null,"created_at":"2038-01-19T03:14:07.000Z","updated_at":"2038-01-19T03:15:07.000Z"},
    {"id":"keyref_demo_current","organization_id":"org_demo_alpha","project_id":"project_demo_alpha","api_major":1,"permissions":["api.read"],"quota_summary":{"window":"hour","request_limit":1000},"state":"active","not_before":"2038-01-19T03:15:07.000Z","expires_at":null,"rotation_predecessor_id":"keyref_demo_previous","created_at":"2038-01-19T03:15:07.000Z","updated_at":"2038-01-19T03:15:07.000Z"}
  ],
  "hosted_config_versions": [
    {"content":{"id":"config_demo_rev1","organization_id":"org_demo_alpha","project_id":"project_demo_alpha","revision":1,"allowed_origins":["https://widget-alpha.example.invalid"],"widget_major":1,"presentation":{"theme":"system","density":"comfortable","show_attribution":true,"max_results":8},"resolver_defaults":{"language_mode":"document","sort_mode":"source_order","empty_state":"generic_message"},"previous_version_id":null,"created_at":"2038-01-19T03:14:07.000Z"},"content_digest":"sha256:aaddec8e9ec989defb2d69aa2e45fed82eabcc03e57e718a3b3ce360af2909ac","lifecycle":{"state":"retired","updated_at":"2038-01-19T03:15:07.000Z"},"signature_metadata":{"status":"design-only-not-signed","algorithm":"none","key_reference":null}},
    {"content":{"id":"config_demo_rev2","organization_id":"org_demo_alpha","project_id":"project_demo_alpha","revision":2,"allowed_origins":["https://widget-alpha.example.invalid"],"widget_major":1,"presentation":{"theme":"dark","density":"compact","show_attribution":true,"max_results":6},"resolver_defaults":{"language_mode":"browser","sort_mode":"alphabetical","empty_state":"hidden"},"previous_version_id":"config_demo_rev1","created_at":"2038-01-19T03:15:07.000Z"},"content_digest":"sha256:39828b01960cb1d0c7580ba23211704df814271dec7986f5cd51662fa4200fc8","lifecycle":{"state":"active","updated_at":"2038-01-19T03:15:07.000Z"},"signature_metadata":{"status":"design-only-not-signed","algorithm":"none","key_reference":null}}
  ],
  "transition_scenarios": [{
    "id":"scenario_demo_rollback",
    "before":{"project_id":"project_demo_alpha","active_config_version_id":"config_demo_rev2","active_config_state":"active","target_config_version_id":"config_demo_rev1","target_config_state":"retired"},
    "command":{"id":"command_demo_rollback","request_id":"request_demo_rollback","action":"activate_hosted_config_version","organization_id":"org_demo_alpha","project_id":"project_demo_alpha","actor_principal_id":"principal_demo_owner","target_config_version_id":"config_demo_rev1","expected_active_config_version_id":"config_demo_rev2","timestamp":"2038-01-19T03:16:07.000Z"},
    "result":{"command_id":"command_demo_rollback","request_id":"request_demo_rollback","outcome":"accepted","reason_code":"activated_prior_content_version","changed":true,"previous_active_config_version_id":"config_demo_rev2","active_config_version_id":"config_demo_rev1","timestamp":"2038-01-19T03:16:07.000Z"},
    "audit_event":{"id":"audit_demo_rollback","command_id":"command_demo_rollback","action":"hosted_config.activated","outcome":"accepted","reason_code":"policy_allowed","actor_principal_id":"principal_demo_owner","organization_id":"org_demo_alpha","project_id":"project_demo_alpha","config_version_id":"config_demo_rev1","key_reference_id":null,"assignment_id":null,"request_id":"request_demo_rollback","timestamp":"2038-01-19T03:16:07.000Z"},
    "expected_after":{"project_id":"project_demo_alpha","active_config_version_id":"config_demo_rev1","active_config_state":"active","prior_config_version_id":"config_demo_rev2","prior_config_state":"retired","updated_at":"2038-01-19T03:16:07.000Z"}
  },{
    "id":"scenario_demo_denied",
    "before":{"project_id":"project_demo_alpha","active_config_version_id":"config_demo_rev2","active_config_state":"active","target_config_version_id":"config_demo_rev1","target_config_state":"retired"},
    "command":{"id":"command_demo_denied","request_id":"request_demo_denied","action":"activate_hosted_config_version","organization_id":"org_demo_alpha","project_id":"project_demo_alpha","actor_principal_id":"principal_demo_other","target_config_version_id":"config_demo_rev1","expected_active_config_version_id":"config_demo_rev2","timestamp":"2038-01-19T03:16:07.000Z"},
    "result":{"command_id":"command_demo_denied","request_id":"request_demo_denied","outcome":"rejected","reason_code":"authorization_denied","changed":false,"active_config_version_id":"config_demo_rev2","timestamp":"2038-01-19T03:16:07.000Z"},
    "audit_event":{"id":"audit_demo_denied","command_id":"command_demo_denied","action":"hosted_config.activated","outcome":"rejected","reason_code":"authorization_denied","actor_principal_id":"principal_demo_other","organization_id":"org_demo_alpha","project_id":"project_demo_alpha","config_version_id":"config_demo_rev1","key_reference_id":null,"assignment_id":null,"request_id":"request_demo_denied","timestamp":"2038-01-19T03:16:07.000Z"},
    "expected_after":{"unchanged":true,"project_id":"project_demo_alpha","active_config_version_id":"config_demo_rev2","active_config_state":"active","target_config_version_id":"config_demo_rev1","target_config_state":"retired"}
  }]
}
